,Unnamed: 0,description,medical_specialty,Target,sample_name,transcription,keywords
17,5," Morbid obesity.  Laparoscopic antecolic antegastric Roux-en-Y gastric bypass with EEA anastomosis.  This is a 30-year-old female, who has been overweight for many years.  She has tried many different diets, but is unsuccessful. ", Bariatrics,2.0, Laparoscopic Gastric Bypass ,"PREOPERATIVE DIAGNOSIS: , Morbid obesity.,POSTOPERATIVE DIAGNOSIS:  ,Morbid obesity.,PROCEDURE: , Laparoscopic antecolic antegastric Roux-en-Y gastric bypass with EEA anastomosis.,ANESTHESIA: , General with endotracheal intubation.,INDICATION FOR PROCEDURE: , This is a 30-year-old female, who has been overweight for many years.  She has tried many different diets, but is unsuccessful.  She has been to our Bariatric Surgery Seminar, received some handouts, and signed the consent.  The risks and benefits of the procedure have been explained to the patient.,PROCEDURE IN DETAIL:  ,The patient was taken to the operating room and placed supine on the operating room table.  All pressure points were carefully padded.  She was given general anesthesia with endotracheal intubation.  SCD stockings were placed on both legs.  Foley catheter was placed for bladder decompression.  The abdomen was then prepped and draped in standard sterile surgical fashion.  Marcaine was then injected through umbilicus.  A small incision was made.  A Veress needle was introduced into the abdomen.  CO2 insufflation was done to a maximum pressure of 15 mmHg.  A 12-mm VersaStep port was placed through the umbilicus.  I then placed a 5-mm port just anterior to the midaxillary line and just subcostal on the right side.  I placed another 5-mm port in the midclavicular line just subcostal on the right side, a few centimeters below and medial to that, I placed a 12-mm VersaStep port.  On the left side, just anterior to the midaxillary line and just subcostal, I placed a 5-mm port.  A few centimeters below and medial to that, I placed a 15-mm port.  I began by lifting up the omentum and identifying the transverse colon and lifting that up and thereby identifying my ligament of Treitz.  I ran the small bowel down approximately 40 cm and divided the small bowel with a white load GIA stapler.  I then divided the mesentery all the way down to the base of the mesentery with a LigaSure device.  I then ran the distal bowel down, approximately 100 cm, and at 100 cm, I made a hole at the antimesenteric portion of the Roux limb and a hole in the antimesenteric portion of the duodenogastric limb, and I passed a 45 white load stapler and fired a stapler creating a side-to-side anastomosis.  I reapproximated the edges of the defect.  I lifted it up and stapled across it with another white load stapler.  I then closed the mesenteric defect with interrupted Surgidac sutures.  I divided the omentum all the way down to the colon in order to create a passageway for my small bowel to go antecolic.  I then put the patient in reverse Trendelenburg.  I placed a liver retractor, identified, and dissected the angle of His.  I then dissected on the lesser curve, approximately 2.5 cm below the gastroesophageal junction, and got into a lesser space.  I fired transversely across the stomach with a 45 blue load stapler.  I then used two fires of the 60 blue load with SeamGuard to go up into my angle of His, thereby creating my gastric pouch.  I then made a hole at the base of the gastric pouch and had Anesthesia remove the bougie and place the OG tube connected to the anvil.  I pulled the anvil into place, and I then opened up my 15-mm port site and passed my EEA stapler.  I passed that in the end of my Roux limb and had the spike come out antimesenteric.  I joined the spike with the anvil and fired a stapler creating an end-to-side anastomosis, then divided across the redundant portion of my Roux limb with a white load GI stapler, and removed it with an Endocatch bag.  I put some additional 2-0 Vicryl sutures in the anastomosis for further security.  I then placed a bowel clamp across the bowel.  I went above and passed an EGD scope into the mouth down to the esophagus and into the gastric pouch.  I distended gastric pouch with air.  There was no air leak seen.  I could pass the scope easily through the anastomosis.  There was no bleeding seen through the scope.  We closed the 15-mm port site with interrupted 0 Vicryl suture utilizing Carter-Thomason.  I copiously irrigated out that incision with about 2 L of saline.  I then closed the skin of all incisions with running Monocryl.  Sponge, instrument, and needle counts were correct at the end of the case.  The patient tolerated the procedure well without any complications.","bariatrics, gastric bypass, eea anastomosis, roux-en-y, antegastric, antecolic, morbid obesity, roux limb, gastric pouch, intubation, laparoscopic, bypass, roux, endotracheal, anastomosis, gastric"
18,6," Liposuction of the supraumbilical abdomen, revision of right breast reconstruction, excision of soft tissue fullness of the lateral abdomen and flank.
", Bariatrics,2.0, Liposuction ,"PREOPERATIVE DIAGNOSES:,1.  Deformity, right breast reconstruction.,2.  Excess soft tissue, anterior abdomen and flank.,3.  Lipodystrophy of the abdomen.,POSTOPERATIVE DIAGNOSES:,1.  Deformity, right breast reconstruction.,2.  Excess soft tissue, anterior abdomen and flank.,3.  Lipodystrophy of the abdomen.,PROCEDURES:,1.  Revision, right breast reconstruction.,2.  Excision, soft tissue fullness of the lateral abdomen and flank.,3.  Liposuction of the supraumbilical abdomen.,ANESTHESIA: , General.,INDICATION FOR OPERATION:,  The patient is a 31-year-old white female who previously has undergone latissimus dorsi flap and implant, breast reconstruction.  She now had lateralization of the implant with loss of medial fullness for which she desired correction.  It was felt that mobilization of the implant medially would provide the patient significant improvement and this was discussed with the patient at length.  The patient also had a small dog ear in the flank area on the right from the latissimus flap harvest, which was to be corrected.  She had also had liposuction of the periumbilical and infraumbilical abdomen with desire to have great improvement superiorly, was felt to be a candidate for such.  The above-noted procedure was discussed with the patient in detail.  The risks, benefits and potential complications were discussed.  She was marked in the upright position and then taken to the operating room for the above-noted procedure.,OPERATIVE PROCEDURE: , The patient was taken to the operating room and placed in the supine position.  Following adequate induction of general LMA anesthesia, the chest and abdomen was prepped and draped in the usual sterile fashion.  The supraumbilical abdomen was then injected with a solution of 5% lidocaine with epinephrine, as was the dog ear.  At this time, the superior central scar was then excised, dissection continued through the subcutaneous tissue, the underlying latissimus muscle until the capsule of the implant was reached.  This was then opened.  The implant was removed and placed on the back table in antibiotic solution.  Using Bovie cautery, the medial capsule was released and undermining was then performed with release of the muscle to the level of the proposed medial projection of the breast.  The inframammary fold medially was secured with 2-0 PDS suture to create greater takeoff point at this level which in the upright position and using a sizer produced a good form.  The lateral pocket was diminished by series of 2-0 PDS suture to provide medialization of the implant.  The implant was then placed back into the submuscular pocket with much improved positioning and medial fullness.  With this completed, the implant was again removed, antibiotic irrigation was performed.  A drain was placed and brought out through a separate inferior stab wound incision and hemostasis was confirmed.  The implant was then replaced and the wound was then closed in layers using 2-0 PDS running suture on the muscle and 3-0 Monocryl Dermabond subcuticular sutures.  The 2.5 cm dog ear was then excised into and including the subcutaneous tissue, even contouring was achieved and this was closed with two layers using 3-0 Monocryl suture.  Using a #3 cannula, a superior umbilical incision, liposuction was carried out into the supraumbilical abdomen, removing approximately 40 to 50 mL of fat with improved supraumbilical contours.  This was closed with 6-0 Prolene suture.  The patient was placed in a compressive garment after treating the incision with Dermabond, Steri-Strips and antibiotic ointment around the drain site and umbilicus.  A Kerlix dressing and a surgical bra was placed to the chest area.  A compressive garment was placed.  The patient was then aroused from anesthesia, extubated, and taken to the recovery room in stable condition.  Sponge, needle, lap, instrument counts were all correct.  The patient tolerated the procedure well.  There were no complications.  The estimated blood loss was approximately 25 mL.","bariatrics, breast reconstruction, excess, lma anesthesia, lipodystrophy, liposuction, abdomen, drain site, flank, latissimus dorsi flap, soft tissue, supraumbilical, surgical bra, supraumbilical abdomen, reconstruction, breast, tissue, implant,"
19,8, Suction-assisted lipectomy - lipodystrophy of the abdomen and thighs., Bariatrics,2.0, Lipectomy - Abdomen/Thighs ,"PREOPERATIVE DIAGNOSIS: , Lipodystrophy of the abdomen and thighs.,POSTOPERATIVE DIAGNOSIS:,  Lipodystrophy of the abdomen and thighs.,OPERATION: , Suction-assisted lipectomy.,ANESTHESIA:,  General.,FINDINGS AND PROCEDURE:,  With the patient under satisfactory general endotracheal anesthesia, the entire abdomen, flanks, perineum, and thighs to the knees were prepped and draped circumferentially in sterile fashion.  After this had been completed, a #15 blade was used to make small stab wounds in the lateral hips, the pubic area, and upper edge of the umbilicus.  Through these small incisions, a cannula was used to infiltrate lactated Ringers with 1000 cc was infiltrated initially into the abdomen.  A 3 and 4-mm cannulas were then used to carry out the liposuction of the abdomen removing a total of 1100 cc of aspirate, which was mostly fat, little fluid, and blood.  Attention was then directed to the thighs both inner and outer.  A total of 1000 cc was infiltrated in both lateral thighs only about 50 cc in the medial thighs.  After this had been completed, 3 and 4-mm cannulas were used to suction 650 cc from each side, approximately 50 cc in the inner thigh and 600 on each lateral thigh.  The patient tolerated the procedure very well.  All of this aspirate was mostly fat with little fluid and very little blood.  Wounds were cleaned and steri-stripped and dressing of ABD pads and ***** was then applied.  The patient tolerated the procedure very well and was sent to the recovery room in good condition.","bariatrics, lipodystrophy, abd pads, suction-assisted lipectomy, abdomen, aspirate, lipectomy, perineum, steri-stripped, thighs, umbilicus, abdomen and thighs, abdomen/thighs, "
20,10," Morbid obesity.  Laparoscopic Roux-en-Y gastric bypass, antecolic, antegastric with 25-mm EEA anastamosis, esophagogastroduodenoscopy.", Bariatrics,2.0, Laparoscopic Gastric Bypass - 1 ,"PREOPERATIVE DIAGNOSIS: , Morbid obesity. ,POSTOPERATIVE DIAGNOSIS: , Morbid obesity. ,PROCEDURE:,  Laparoscopic Roux-en-Y gastric bypass, antecolic, antegastric with 25-mm EEA anastamosis, esophagogastroduodenoscopy. ,ANESTHESIA: , General with endotracheal intubation. ,INDICATIONS FOR PROCEDURE: , This is a 50-year-old male who has been overweight for many years and has tried multiple different weight loss diets and programs.  The patient has now begun to have comorbidities related to the obesity.  The patient has attended our bariatric seminar and met with our dietician and psychologist.  The patient has read through our comprehensive handout and understands the risks and benefits of bypass surgery as evidenced by the signing of our consent form.,PROCEDURE IN DETAIL: , The risks and benefits were explained to the patient.  Consent was obtained.  The patient was taken to the operating room and placed supine on the operating room table.  General anesthesia was administered with endotracheal intubation.  A Foley catheter was placed for bladder decompression.  All pressure points were carefully padded, and sequential compression devices were placed on the legs.  The abdomen was prepped and draped in standard, sterile, surgical fashion.  Marcaine was injected into the umbilicus.","bariatrics, morbid obesity, roux-en-y, gastric bypass, antecolic, antegastric, anastamosis, esophagogastroduodenoscopy, eea, surgidac sutures, roux limb, port, stapler, laparoscopic, intubation"
21,13, Patient presented to the bariatric surgery service for consideration of laparoscopic roux en Y gastric bypass surgery. , Bariatrics,2.0, Gastric Bypass Discussion - 3 ,"PAST MEDICAL HISTORY:,  Significant for hypertension.  The patient takes hydrochlorothiazide for this.  She also suffers from high cholesterol and takes Crestor.  She also has dry eyes and uses Restasis for this.  She denies liver disease, kidney disease, cirrhosis, hepatitis, diabetes mellitus, thyroid disease, bleeding disorders, prior DVT, HIV and gout.  She also denies cardiac disease and prior history of cancer.,PAST SURGICAL HISTORY: , Significant for tubal ligation in 1993.  She had a hysterectomy done in 2000 and a gallbladder resection done in 2002.,MEDICATIONS: , Crestor 20 mg p.o. daily, hydrochlorothiazide 20 mg p.o. daily, Veramist spray 27.5 mcg daily, Restasis twice a day and ibuprofen two to three times a day.,ALLERGIES TO MEDICATIONS: , Bactrim which causes a rash.  The patient denies latex allergy.,SOCIAL HISTORY: , The patient is a life long nonsmoker.  She only drinks socially one to two drinks a month.  She is employed as a manager at the New York department of taxation.  She is married with four children.,FAMILY HISTORY: , Significant for type II diabetes on her mother's side as well as liver and heart failure.  She has one sibling that suffers from high cholesterol and high triglycerides.,REVIEW OF SYSTEMS: , Positive for hot flashes.  She also complains about snoring and occasional slight asthma.  She does complain about peripheral ankle swelling and heartburn.  She also gives a history of hemorrhoids and bladder infections in the past.  She has weight bearing joint pain as well as low back degenerating discs.  She denies obstructive sleep apnea, kidney stones, bloody bowel movements, ulcerative colitis, Crohn's disease, dark tarry stools and melena.,PHYSICAL EXAMINATION:  ,On examination temperature is 97.7, pulse 84, blood pressure 126/80, respiratory rate was 20.  Well nourished, well developed in no distress.  Eye exam, pupils equal round and reactive to light.  Extraocular motions intact.  Neuro exam deep tendon reflexes 1+ in the lower extremities.  No focal neuro deficits noted.  Neck exam nonpalpable thyroid, midline trachea, no cervical lymphadenopathy, no carotid bruit.  Lung exam clear breath sounds throughout without rhonchi or wheezes however diminished.  Cardiac exam regular rate and rhythm without murmur or bruit.  Abdominal exam positive bowel sounds, soft, nontender, obese, nondistended abdomen.  No palpable tenderness.  No right upper quadrant tenderness.  No organomegaly appreciated.  No obvious hernias noted.  Lower extremity exam +1 edema noted.  Positive dorsalis pedis pulses.,ASSESSMENT: , The patient is a 56-year-old female who presents to the bariatric surgery service with a body mass index of 41 with obesity related comorbidities.  The patient is interested in gastric bypass surgery.  The patient appears to be an excellent candidate and would benefit greatly in the management of her comorbidities.,PLAN: , In preparation for surgery will obtain the usual baseline laboratory values including baseline vitamin levels.  Will proceed with our usual work up with an upper GI series as well as consultations with the dietician and the psychologist preoperatively.  I have recommended six weeks of Medifast for the patient to obtain a 10% preoperative weight loss.","bariatrics, weight watchers, roux en y, atkins, medifast, meridia, south beach, cabbage, diets, laparoscopic roux en y gastric bypass surgery, rice, weight loss, six weeks of medifast, weight loss modalities, body mass index, gastric bypass surgery, bariatric surgery, gastric bypass,"
22,15, Preoperative visit for weight management with laparoscopic gastric banding, Bariatrics,2.0, Laparoscopic Gastric Banding - Preop Visit  ,"HISTORY OF PRESENT ILLNESS: ,I have seen ABC today for her preoperative visit for weight management.  I have explained to her the need for Optifast for weight loss prior to these procedures to make it safer because of the large size of her liver.  She understands this.,IMPRESSION/PLAN:, We are going to put her on two weeks of Optifast at around 900 calories.  I have also explained the risks and potential complications of laparoscopic cholecystectomy to her in detail including bleeding, infection, deep venous thrombosis, pulmonary embolism, injury to the small intestine, stomach, liver, leak from the cystic duct, common bile duct, and possible need for ERCP and further surgery.  This surgery is going to be planned for October 6.  This is for cholelithiasis prior to her Lap-Banding procedure.,I have also reviewed with her the risks and potential complications of laparoscopic gastric banding including bleeding, infection, deep venous thrombosis, pulmonary embolism, slippage of the band, erosion of the band, injury to the esophagus, stomach, small intestine, large intestine, spleen, liver, injury to the band, port, or tubing necessitating replacement of the band, port, or tubing among other potential complications and she understands.  We are going to proceed for laparoscopic gastric banding.  I have reviewed her entire chart in detail.  I have also gone over with her the Fairfield County Bariatrics consent form for banding and all the risks.  She has also signed the St. Vincent's Hospital consent form for Lap-Banding.  She has taken the preoperative quiz for banding.  She has signed the preop and postop instructions, and understands them and we reviewed them.  She has taken the quiz and done fairly well.  We have reviewed with her any potential other issues and I have answered her questions.  She is planned for surgical intervention.,","bariatrics, laparoscopic gastric banding, pulmonary embolism, lap banding, potential complications, gastric banding, banding, stomach, gastric, laparoscopic, weightNOTE"
23,17, Patient status post lap band placement., Bariatrics,2.0, Lap Band Adjustment ,"REASON FOR VISIT:,  Lap band adjustment.,HISTORY OF PRESENT ILLNESS:,  Ms. A is status post lap band placement back in 01/09 and she is here on a band adjustment.  Apparently, she had some problems previously with her adjustments and apparently she has been under a lot of stress.  She was in a car accident a couple of weeks ago and she has problems, she does not feel full.  She states that she is not really hungry but she does not feel full and she states that she is finding when she is hungry at night, having difficulty waiting until the morning and that she did mention that she had a candy bar and that seemed to make her feel better.,PHYSICAL EXAMINATION: , On exam, her temperature is 98, pulse 76, weight 197.7 pounds, blood pressure 102/72, BMI is 38.5, she has lost 3.8 pounds since her last visit.  She was alert and oriented in no apparent distress.  ,PROCEDURE:  ,I was able to access her port.  She does have an AP standard low profile.  I aspirated 6 mL, I did add 1 mL, so she has got approximately 7 mL in her band, she did tolerate water postprocedure.,ASSESSMENT:,  The patient is status post lap band adjustments, doing well, has a total of 7 mL within her band, tolerated water postprocedure.  She will come back in two weeks for another adjustment as needed.,","bariatrics, lap band adjustment, lap band placement, lap band, "
24,21, Patient discharged after laparoscopic Roux-en-Y gastric bypass., Bariatrics,2.0, Gastric Bypass Summary ,"FINAL DIAGNOSES,1.  Morbid obesity, status post laparoscopic Roux-en-Y gastric bypass. ,2.  Hypertension. ,3.  Obstructive sleep apnea, on CPAP.,OPERATION AND PROCEDURE: , Laparoscopic Roux-en-Y gastric bypass.,BRIEF HOSPITAL COURSE SUMMARY:  ,This is a 30-year-old male, who presented recently to the Bariatric Center for evaluation and treatment of longstanding morbid obesity and associated comorbidities.  Underwent standard bariatric evaluation, consults, diagnostics, and preop Medifast induced weight loss in anticipation of elective bariatric surgery. ,Taken to the OR via same day surgery process for elective gastric bypass, tolerated well, recovered in the PACU, and sent to the floor for routine postoperative care.  There, DVT prophylaxis was continued with subcu heparin, early and frequent mobilization, and SCDs.  PCA was utilized for pain control, efficaciously, he utilized the CPAP, was monitored, and had no new cardiopulmonary complaints.  Postop day #1, labs within normal limits, able to clinically start bariatric clear liquids at 2 ounces per hour, this was tolerated well.  He was ambulatory, had no cardiopulmonary complaints, no unusual fever or concerning symptoms.  By the second postoperative day, was able to advance to four ounces per hour, tolerated this well, and is able to discharge in stable and improved condition today.  He had his drains removed today as well.,DISCHARGE INSTRUCTIONS: , Include re-appointment in the office in the next week, call in the interim if any significant concerning complaints.  Scripts left in the chart for omeprazole and Lortab.  Med rec sheet completed (on no meds).  He will maintain bariatric clear liquids at home, goal 64 ounces per day, maintain activity at home, but no heavy lifting or straining.  Can shower starting tomorrow, drain site care and wound care reviewed.  He will re-appoint in the office in the next week, certainly call in the interim if any significant concerning complaints.","bariatrics, medifast, laparoscopic roux-en-y gastric bypass, roux-en-y, bariatric clear liquids, gastric bypass, laparoscopic, gastric, bariatric, bypass, "
