,Unnamed: 0,description,medical_specialty,Target,sample_name,transcription,keywords
101,4673, Ligation and stripping of left greater saphenous vein to the level of the knee.  Stripping of multiple left lower extremity varicose veins.  Varicose veins., Cardiovascular / Pulmonary,3.0, Saphenous Vein - Ligation & Stripping ,"PREOPERATIVE DIAGNOSIS:,  Varicose veins.,POSTOPERATIVE DIAGNOSIS: , Varicose veins.,PROCEDURE PERFORMED:,1.  Ligation and stripping of left greater saphenous vein to the level of the knee.,2.  Stripping of multiple left lower extremity varicose veins.,ANESTHESIA:,  General endotracheal.,ESTIMATED BLOOD LOSS: , Approximately 150 mL.,SPECIMENS: , Multiple veins.,COMPLICATIONS:,  None.,BRIEF HISTORY:,  This is a 30-year-old Caucasian male who presented for elective evaluation from Dr. X's office for evaluation of intractable pain from the left lower extremity.  The patient has had painful varicose veins for number of years.  He has failed conservative measures and has felt more aggressive treatment to alleviate his pain secondary to his varicose veins.  It was recommended that the patient undergo a saphenous vein ligation and stripping.  He was explained the risks, benefits, and complications of the procedure including intractable pain.  He gave informed consent to proceed.,OPERATIVE FINDINGS:,  The left greater saphenous vein femoral junction was identified and multiple tributaries were ligated surrounding this region.,The vein was stripped from the saphenofemoral junction to the level of the knee.  Multiple tributaries of the greater saphenous vein and varicose veins from the left lower extremity were ligated and stripped accordingly.  Additionally, there were noted to be multiple regions within these veins that were friable and edematous consistent with acute and chronic inflammatory changes making stripping of these varicose veins extremely difficult.,OPERATIVE PROCEDURE:  ,The patient was marked preoperatively in the Preanesthesia Care Unit.  The patient was brought to the operating suite, placed in the supine position.  The patient underwent general endotracheal intubation.  After adequate anesthesia was obtained, the left lower extremity was prepped and draped circumferentially from the foot all the way to the distal section of the left lower quadrant and just right of midline.  A diagonal incision was created in the direction of the inguinal crease on the left.  A self-retaining retractor was placed and the incision was carried down through the subcutaneous tissues until the greater saphenous vein was identified.  The vein was isolated with a right angle.  The vein was followed proximally until a multiple tributary branches were identified.  These were ligated with #3-0 silk suture.  The dissection was then carried to the femorosaphenous vein junction.  This was identified and #0 silk suture was placed proximally and distally and ligated in between.  The proximal suture was tied down.  Distal suture was retracted and a vein stripping device was placed within the greater saphenous vein.  An incision was created at the level of the knee.  The distal segment of the greater saphenous vein was identified and the left foot was encircled with #0 silk suture and tied proximally and then ligated.  The distal end of the vein stripping device was then passed through at its most proximal location.  The device was attached to the vein stripping section and the greater saphenous vein was then stripped free from its canal within the left lower extremity.  Next, attention was made towards the multiple tributaries of the varicose vein within the left lower leg.  Multiple incisions were created with a #15 blade scalpel.  The incisions were carried down with electrocautery.  Next, utilizing sharp dissection with a hemostat, the tissue was spread until the vein was identified.  The vein was then followed to T3 and in all these locations intersecting segments of varicose veins were identified and removed.  Additionally, some segments were removed.  The stripping approach would be vein stripping device.  Multiple branches of the saphenous vein were then ligated and/or removed.  Occasionally, dissection was unable to be performed as the vein was too friable and would tear from the hemostat.  Bleeding was controlled with direct pressure.  All incisions were then closed with interrupted #3-0 Vicryl sutures and/or #4-0 Vicryl sutures.,The femoral incision was closed with interrupted multiple #3-0 Vicryl sutures and closed with a running #4-0 subcuticular suture.  The leg was then cleaned, dried, and then Steri-Strips were placed over the incisions.  The leg was then wrapped with a sterile Kerlix.  Once the Kerlix was achieved, an Ace wrap was placed over the left lower extremity for compression.  The patient tolerated the procedure well and was transferred to Postanesthesia Care Unit extubated in stable condition.  He will undergo evaluation postoperatively and will be seen shortly in the postanesthesia care unit.","cardiovascular / pulmonary, varicose veins, saphenous vein, stripping, ligation, vein stripping, lower extremity, saphenous, varicose, vein, ligated, "
102,4674, Complete heart block with pacemaker malfunction and  a history of Shone complex., Cardiovascular / Pulmonary,1.0, Shone complex ,"HISTORY AND PHYSICAL:  ,The patient is a 13-year-old, who has a history of Shone complex and has a complete heart block.  He is on the pacemaker.  He had a coarctation of the aorta and that was repaired when he was an infant.  He was followed in our Cardiology Clinic here and has been doing well.  However last night, he was sleeping, and he states he felt as if he has having a dream, and there was thunder in this dream, which woke him up.  He then felt that his defibrillator was going off and this has continued and feels like his heart rate is not normal.  Thus, his dad put him in the car and transported him here.  He has been evaluated here.  He had some scar tissue at one point when the internal pacemaker was not working properly and had to have that replaced.  It was 2 a.m. when he woke, and again, he was brought here by private vehicle.  He was well prior to going to bed.  No cough, cold, runny nose, fever.  No trauma has been noted.,PAST MEDICAL HISTORY:,  Shone complex, pacemaker dependent.,MEDICATIONS: , He is on no medications at this time.,ALLERGIES:,  He has no allergies.,IMMUNIZATIONS:,  Up to date.,SOCIAL HISTORY: , He lives with his parents.,FAMILY HISTORY: , Negative.,REVIEW OF SYSTEM: , Twelve asked, all negative, except as noted above.,PHYSICAL EXAMINATION:,GENERAL:  This is an awake, alert male, who appears to be in mild distress.,HEENT:  Pupils are equal, round, and reactive to light.  Extraocular movements are intact.  His TMs are clear.  His nares are clear.  The mucous membranes are pink and moist.  Throat is clear.,NECK:  Supple without lymphadenopathy or masses.  Trachea is midline.,LUNGS:  Clear.,HEART:  Shows bradycardia at 53.  He has good distal pulses.,ABDOMEN:  Soft, nontender.  Positive bowel sounds.  No guarding, no rebound.  No rashes are seen.,HOSPITAL COURSE:,  Initial blood pressure is 164/90.  He was moved in room 1.  He was placed on nasal cannula.  Pulse ox was 100%, which is normal.  We placed him on a monitor.  We did an EKG; it has not appear to be capturing his pacemaker at this time.  Shortly after the patient's arrival, the Medtronic technician came and worked out his pacemaker.  Medtronic representative informed me that the lead that he has in place has been recalled because it has been prone to microfractures, oversensing, and automatic defibrillation.  As noted, he was transferred to room 1, placed on a monitor, pulse ox.  An IV was placed.  A standard blood work was sent.  A chest x-ray was done showing normal heart size, lead appeared to be in placed.  There was no evidence of pulmonary edema.  His pacemaker did not appear to be capturing.  We placed him on transthoracic leads.  However, it is difficult to get good placement with these because of the area where his pacemaker was placed.  The Medtronic technician initially turned off his defibrillation mode and turned down his sensor.  However, we could not get our transthoracic pacer to capture his heart.  When the Medtronic representative turned off the pacemaker, the heart rate seemed to drop into the 40s.  The patient appeared to be in pain.  We placed it back on a rate of 60 at that time.  He has remained in sinus bradycardia, but no evidence of ectopic beats.  No widening of his QRS complex.  I spoke with Cardiology.  Cardiology service has come in, has evaluated him at bedside with me.  Again, we turned up the transthoracic pacer, but it is again not seem to be picking up, and his heart rate is still going with the Medtronic's internal pacemaker.  So with the ICU physician on call, Dr. X, he has agreed with taking this young man to the ICU.,An hour after presentation here, the ICU was ready for bed.  I accompanied the patient up to the ICU.  He remained awake and alert.  Initially, he was complaining of a lot of chest pain.  Once the defibrillator was turned off, he had no more pain.  He was transported to the Pediatrics PICU and delivered in stable condition.,LABORATORY DATA: , CBC was normal.  Chem-20 was normal as well.,IMPRESSION:  ,Complete heart block with pacemaker malfunction.,PLAN:  ,He is admitted to the ICU.,TIME SEEN: , Critical care time outside billable procedures was 45 minutes with this patient.  I should note that a 12-lead EKG was done here showing sinus bradycardia, normal intervals otherwise.",
103,4675," Selective coronary angiography, coronary angioplasty.  Acute non-ST-elevation MI.", Cardiovascular / Pulmonary,1.0, Selective Coronary Angiography & Angioplasty ,"PREOPERATIVE DIAGNOSIS AND INDICATIONS:,  Acute non-ST-elevation MI.,POSTOPERATIVE DIAGNOSIS AND SUMMARY:,  The patient presented with an acute non-ST-elevation MI.  Despite medical therapy, she continued to have intermittent angina.  Angiography demonstrated the severe LAD as the culprit lesion.  This was treated as noted above with angioplasty alone as the stent could not be safely advanced.  She has residual lesions of 75% in the proximal right coronary and 60% proximal circumflex, and the other residual LAD lesions as noted above.  She will be continued on her medical therapy.  At age 90, she is not a good candidate for aortic valve replacement and coronary bypass grafting.,PROCEDURE PERFORMED: , Selective coronary angiography, coronary angioplasty.,PROCEDURE IN DETAIL:,  After informed consent was obtained, the patient was taken to the cath lab, placed on the table in the supine position.  The area of the right femoral artery was prepped and draped in a sterile fashion.  Using the percutaneous technique, a 6-French sheath was placed in the right femoral artery under fluoroscopic guidance.  With the guidewire in place, a 5-French JL-4 catheter was used to selectively angiogram the left coronary system.  The catheter was removed.  The sheath flushed.  The 5-French 3DRC catheter was then used to selectively angiogram the right coronary artery.  The cath removed, the sheath flushed.,It was decided that intervention was needed in the severe lesions in the LAD, which appeared to be the culprit lesions for the non-ST elevation-MI.  The patient was given a bolus of heparin and an ACT of approximately 50 seconds was obtained, we rebolused and the ACT was slightly lower.  We repeated the level and it was slightly higher.  We administered 500 more units of heparin and then proceeded with an ACT of approximately 270 seconds prior to the 500 units of heparin IV.  Additionally, the patient had been given 300 mg of Plavix orally during the procedure and Integrilin IV bolus and then maintenance drip was started.,A 6-French CLS 3.5 left coronary guide catheter was used to cannulate the left main and HEW guidewire was positioned in the distal LAD and another HEW guidewire in the relatively large third diagonal.  An Apex 2.5 x 15 mm balloon was positioned in the distal portion of the mid LAD stenosis and inflated to 6 atmospheres for 15 seconds and then deflated.  Angiography was then performed, demonstrated marked improvement in the stenosis and this image was used for sizing the last of the needed stent.  The balloon was pulled more proximally and then inflated again at 6 atmospheres for approximately 20 seconds, with the proximal end of the balloon positioned distal to the origin of the third diagonal so as to not compromise the ostium.  The balloon was inflated and removed, repeat angiography performed.  We attempted to advance a Driver 2.5 x 24 mm bare metal stent, but I could not advance it beyond the proximal LAD, where there was significant calcification.  The stent was removed.  Attempts to advance the same 2.5 x 15 mm Apex balloon that was previously used were unsuccessful.  It was removed, a new Apex 2.5 x 15 mm balloon was then positioned in the proximal LAD and inflated to 6 atmospheres for 15 seconds and then deflated and advanced slightly with the distal tip of the balloon proximal to the third diagonal ostium and it was inflated to 6 atmospheres for 15 seconds and then deflated and removed.  Repeat angiography demonstrated no evidence of dissection.  One more attempt was made to advance the Driver 2.5 x 24 mm bare metal stent, but again I could not advance it beyond the calcified plaque in the proximal LAD and this was despite the presence of the buddy wire in the diagonal.  I felt that further attempts in this calcified vessel in a 90-year-old with severe aortic stenosis and severe aortic insufficiency would likely result in complications of dissection, so the stent was removed.  The guidewires and guide cath were removed.  The sheath flushed and sutured into position.  The patient moved to ICU in stable condition with no chest discomfort at all.,CONTRAST: , Isovue-370, 120 mL.,FLUORO TIME: , 9.4 minutes.,ESTIMATED BLOOD LOSS: , 30 mL.,HEMODYNAMICS:,  Aorta 185/54.,Left ventriculography was not performed.  I did not make an attempt to cross this severely stenotic aortic valve.,The left main is a large vessel, giving rise to LAD and circumflex vessels.  The left main has no significant disease other than calcification in the walls.,The LAD is a moderate-to-large vessel, giving rise to small diagonals and then a moderate-to-large third diagonal, and then a small fourth diagonal.  The LAD has significant calcification proximally.  There is a 50% stenosis between the first and second diagonals that we treated with angioplasty alone in an attempt to be able to advance the stent.  This resulted in a 30% residual, mostly eccentric calcified plaque.  Following this, there was a 50% stenosis in the LAD just after the takeoff of the third diagonal.  This was not ballooned.  Beyond this is an 80% stenosis prior to the fourth diagonal and then a 99% stenosis after the fourth diagonal.  These 2 lesions were dilated with 10% residual prior to the fourth diagonal and 25% residual distal to the fourth diagonal.  As noted above, this area was not stented because I could not safely advance the stent.  Note, there was also a 50% stenosis at the origin of the moderate-to-large third diagonal that did not change with angioplasty.,The circumflex is a large, nondominant vessel consisting of a large obtuse marginal with multiple branches.  The proximal circumflex has an eccentric 60% stenosis prior to the takeoff of the obtuse marginal.  The remainder of the vessel was without significant disease.,The right coronary was a large, dominant vessel giving rise to a large posterior descending artery and small-to-moderate first posterolateral, small second posterolateral, and a small-to-moderate third posterolateral branch.  The right coronary has an eccentric smooth 75% stenosis beginning about a centimeter after the origin of the vessel and prior to the acute marginal branch.  The remainder of the right coronary and its branches were without significant disease.","cardiovascular / pulmonary, non-st-elevation mi, selective coronary angiography, coronary angioplasty, calcified plaque, coronary angiography, st elevation, stenosis, lad, coronary, selective, angiography, angioplasty, balloon, vessel, stent, "
104,4676," Elevated cardiac enzymes, fullness in chest, abnormal EKG, and risk factors.  No evidence of exercise induced ischemia at a high myocardial workload.  This essentially excludes obstructive CAD as a cause of her elevated troponin.", Cardiovascular / Pulmonary,3.0, Radionuclide Stress Test ,"INDICATION FOR STUDY: , Elevated cardiac enzymes, fullness in chest, abnormal EKG, and risk factors.,MEDICATIONS:,  Femara, verapamil, Dyazide, Hyzaar, glyburide, and metformin.,BASELINE EKG: , Sinus rhythm at 84 beats per minute, poor anteroseptal R-wave progression, mild lateral ST abnormalities.,EXERCISE RESULTS:,1.  The patient exercised for 3 minutes stopping due to fatigue.  No chest pain.,2.  Heart rate increased from 84 to 138 or 93% of maximum predicted heart rate.  Blood pressure rose from 150/88 to 210/100.  There was a slight increase in her repolorization abnormalities in a non-specific pattern.,NUCLEAR PROTOCOL:  ,Same day rest/stress protocol was utilized with 11 mCi for the rest dose and 33 mCi for the stress test.,NUCLEAR RESULTS:,1.  Nuclear perfusion imaging, review of the raw projection data reveals adequate image acquisition.  The resting images showed decreased uptake in the anterior wall.  However the apex is spared of this defect.  There is no significant change between rest and stress images.  The sum score is 0.,2.  The Gated SPECT shows moderate LVH with slightly low EF of 48%.,IMPRESSION:,1.  No evidence of exercise induced ischemia at a high myocardial workload.  This essentially excludes obstructive CAD as a cause of her elevated troponin.,2.  Mild hypertensive cardiomyopathy with an EF of 48%.,3.  Poor exercise capacity due to cardiovascular deconditioning.,4.  Suboptimally controlled blood pressure on today's exam.","cardiovascular / pulmonary, sinus rhythm, cardiac enzymes, abnormal ekg, stress test, elevated troponin, heart rate, blood pressure, radionuclide, chest, ekg, stress, ischemia"
105,4677," A 23-month-old girl has a history of reactive airway disease, is being treated on an outpatient basis for pneumonia, presents with cough and fever.", Cardiovascular / Pulmonary,1.0, Reactive Airway Disease ,"CHIEF COMPLAINT AND IDENTIFICATION:,  A is a 23-month-old girl, who has a history of reactive airway disease who is being treated on an outpatient basis for pneumonia who presents with cough and fever.,HISTORY OF PRESENT ILLNESS: , The patient is to known to have reactive airway disease and uses Pulmicort daily and albuterol up to 4 times a day via nebulization.,She has no hospitalizations.,The patient has had a 1 week or so history of cough.  She was seen by the primary care provider and given amoxicillin for yellow nasal discharge according to mom.  She has been taking 1 teaspoon every 6 hours.  She originally was having some low-grade fever with a maximum of 100.4 degrees Fahrenheit; however, on the day prior to admission, she had a 104.4 degrees Fahrenheit temperature, and was having posttussive emesis.  She is using her nebulizer, but the child was in respiratory distress, and this was not alleviated by the nebulizer, so she was brought to Children's Hospital Central California.,At Children's Hospital, the patient was originally treated as an asthmatic and was receiving nebulized treatments; however, a chest x-ray did show right-sided pneumonia, and the patient was hypoxemic after resolution of her respiratory distress, so the Hospitalist Service was contacted regarding admission.  The patient was seen and admitted through the emergency room.,REVIEW OF SYSTEMS: , Negative except that indicated in the history of present illness.  All systems were checked.,PAST MEDICAL HISTORY: , As stated in the history of present illness, no hospitalizations, no surgeries.,IMMUNIZATIONS: , The patient is up-to-date on her shots.  She has a schedule for her 2-year-old shot soon.,ALLERGIES: , No known drug allergies.,DEVELOPMENT HISTORY: , Developmentally, she is within normal limits.,FAMILY HISTORY:,  Her maternal uncles have asthma.  There are multiple family members on the maternal side that have diabetes mellitus, otherwise the family history is negative for other chronic medical conditions.,SOCIAL HISTORY: , Her sister has a runny nose, but no other sick contacts.  The family lives in Delano.  She lives with her mom and sister.  The dad is involved, but the parents are separated.  There is no smoking exposure.,PHYSICAL EXAMINATION:,  ,GENERAL:  The child was in no acute distress.,VITAL SIGNS:  Temperature 99.8 degrees Fahrenheit, heart rate 144, respiratory rate 28.  Oxygen saturations 98% on continuous.  Off of oxygen shows 85% laying down on room air.  The T-max in the ER was 101.3 degrees Fahrenheit.,SKIN:  Clear.,HEENT:  Pupils were equal, round, react to light.  No conjunctival injection or discharge.  Tympanic membranes were clear.  No nasal discharge.  Oropharynx moist and clear.,NECK:  Supple without lymphadenopathy, thyromegaly, or masses.,CHEST:  Clear to auscultation bilaterally; no tachypnea, wheezing, or retractions.,CARDIOVASCULAR:  Regular rate and rhythm.  No murmurs noted.  Well perfused peripherally.,ABDOMEN:  Bowel sounds are present.  The abdomen is soft.  There is no hepatosplenomegaly, no masses, nontender to palpation.,GENITOURINARY:  No inguinal lymphadenopathy.  Tanner stage I female.,EXTREMITIES:  Symmetric in length.  No joint effusions.  She moves all extremities well.,BACK:  Straight.  No spinous defects.,NEUROLOGIC:  The patient has a normal neurologic exam.  She is sitting up solo in bed, gets on her knees, stands up, is playful, smiles, is interactive.  She has no focal neurologic deficits.,LABORATORY DATA: , Chest x-ray by my reading shows a right lower lobe infiltrate.  Metabolic panel:  Sodium 139, potassium 3.5, chloride 106, total CO2 22, BUN and creatinine are 5 and 0.3 respectively, glucose 84, CRP 4.3.  White blood cell count 13.7, hemoglobin and hematocrit 9.6 and 29.9 respectively, and platelets 294,000.  Differential of the white count 34% lymphocytes, 55% neutrophils.,ASSESSMENT AND PLAN: , This is a 22-month-old girl, who has an infiltrate on the x-ray, hypoxemia, and presented in respiratory distress.  I believe, she has bacterial pneumonia, which is partially treated by her amoxicillin, which is a failure of her outpatient treatment.  She will be placed on the pneumonia pathway and started on cefuroxime to broaden her coverage.  She is being admitted for hypoxemia.  I hope that this will resolve overnight, and she will be discharged in the morning.  I will start her home medications of Pulmicort twice daily and albuterol on a p.r.n. basis; however, at this point, she has no wheezing, so no systemic steroids will be instituted.,Further interventions will depend on the clinical course.",
106,4678, Pulmonary function test.  Mild restrictive airflow limitation.  Clinical correlation is recommended., Cardiovascular / Pulmonary,3.0, Pulmonary Function Test - 5 ,"OBSERVATIONS: , FEV1 is 3.76, 103% predicted.  FVC is 4.98, 110% predicted.  Ratio is 75.  FEF 25-75 is 3.053, 82% predicted, postbronchodilator improves by 35%.  DLCO is 35, 121% predicted.  Residual volume is 3.04, 139% predicted.  Total lung capacity is 8.34, 120% predicted.,Flow volume loop reviewed.,INTERPRETATION:,  Mild restrictive airflow limitation.  Clinical correlation is recommended.","cardiovascular / pulmonary, fev1, fvc, fef, dlco, lung capacity, postbronchodilator, pulmonary function test, restrictive airflowNOTE,: Thesetranscribed medical transcription sample reports and examples are provided by various users andare for reference purpose only. MTHelpLine does not certify accuracy and quality of sample reports.These transcribed medical transcription sample reports may include some uncommon or unusual formats;this would be due to the preference of the dictating physician. All names and dates have beenchanged (or removed) to keep confidentiality. Any resemblance of any type of name or date orplace or anything else to real world is purely incidental."
