,Unnamed: 0,description,medical_specialty,Target,sample_name,transcription,keywords
62,4634," Aortic stenosis.   Insertion of a Toronto stentless porcine valve, cardiopulmonary bypass, and cold cardioplegia arrest of the heart.", Cardiovascular / Pulmonary,3.0, Toronto Porcine Valve Insertion ,"PREOPERATIVE DIAGNOSIS:,  Aortic stenosis.,POSTOPERATIVE DIAGNOSIS:  ,Aortic stenosis.,PROCEDURES PERFORMED,1.  Insertion of a **-mm Toronto stentless porcine valve.,2.  Cardiopulmonary bypass.,3.  Cold cardioplegia arrest of the heart.,ANESTHESIA: , General endotracheal anesthesia.,ESTIMATED BLOOD LOSS:  , 300 cc.,INTRAVENOUS FLUIDS:  , 1200 cc of crystalloid.,URINE OUTPUT:  , 250 cc.,AORTIC CROSS-CLAMP TIME: , **,CARDIOPULMONARY BYPASS TIME TOTAL: , **,PROCEDURE IN DETAIL:,  After obtaining informed consent from the patient, including a thorough explanation of the risks and benefits of the aforementioned procedure, patient was taken to the operating room and general endotracheal anesthesia was administered.  Next the neck, chest and legs were prepped and draped in the standard surgical fashion.  We used a #10-blade scalpel to make a midline median sternotomy incision.  Dissection was carried down to the left of the sternum using Bovie electrocautery.  The sternum was opened with a sternal saw.  The chest retractor was positioned.  Next, full-dose heparin was given.  The pericardium was opened.  Pericardial stay sutures were positioned.  After obtaining adequate ACT, we prepared to place the patient on cardiopulmonary bypass.  A 2-0 double pursestring of Ethibond suture was placed in the ascending aorta.  Through this was passed an aortic cannula connected to the arterial side of the cardiopulmonary bypass machine.  Next a 3-0 Prolene pursestring was placed in the right atrial appendage.  Through this was passed our venous cannula connected to the venous portion of the cardiopulmonary bypass machine.  A 4-0 U-stitch was placed in the right atrium.  A retrograde cardioplegia catheter was positioned at this site.  Next, scissors were used to dissect out the right upper pulmonary vein.  A 4-0 Prolene pursestring was placed in the right upper pulmonary vein.  Next, a right-angle sump was placed at this position.  We then connected our retrograde cardioplegia catheter to the cardioplegia solution circuit.  Bovie electrocautery was used to dissect the interface between the aorta and pulmonary artery.  The aorta was completely encircled.  Next, an antegrade cardioplegia needle and associated sump were placed in the ascending aorta.  We then prepared to cross-clamp the aorta.  We went down on our flows and cross-clamped the aorta.  We backed up our flows.  We then gave antegrade and retrograde cold blood cardioplegia solution circuit so as to arrest the heart.  The patient had some aortic insufficiency so we elected, after initially arresting the heart, to open the aorta and transect it and then give direct ostial infusion of cardioplegia solution circuit.  Next, after obtaining complete diastolic arrest of the heart, we turned our attention to exposing the aortic valve, and 4-0 Tycron sutures were placed in the commissures.  In addition, a 2-0 Prolene suture was placed in the aortic wall so as to bring the aortic wall and root up into view.  Next, scissors were used to excise the diseased aortic valve leaflets.  Care was taken to remove all the calcium from the aortic annulus.  We then sized up the aortic annulus which came out to be a **-mm stentless porcine Toronto valve.  We prepared the valve.  Next, we placed our proximal suture line of interrupted 4-0 Tycron sutures for the annulus.  We started with our individual commissural stitches.  They were connected to our valve sewing ring.  Next, we placed 5 interrupted 4-0 Tycron sutures in a subannular fashion at each commissural position.  After doing so, we passed 1 end of the suture through the sewing portion of the Toronto stentless porcine valve.  The valve was lowered into place and all of the sutures were tied.  Next, we gave another round of cold blood antegrade and retrograde cardioplegia.  Next, we sewed our distal suture line.  We began with the left coronary cusp of the valve.  We ran a 5-0 RB needle up both sides of the valve.  Care was taken to avoid the left coronary ostia.  This procedure was repeated on the right cusp of the stentless porcine valve.  Again, care was taken to avoid any injury to the coronary ostia.  Lastly, we sewed our non-coronary cusp.  This was done without difficulty.  At this point we inspected our aortic valve.  There was good coaptation of the leaflets, and it was noted that both the left and the right coronary ostia were open.  We gave another round of cold blood antegrade and retrograde cardioplegia.  The antegrade portion was given in a direct ostial fashion once again.  We now turned our attention to closing the aorta.  A 4-0 Prolene double row of suture was used to close the aorta in a running fashion.  Just prior to closing, we de-aired the heart and gave a warm shot of antegrade and retrograde cardioplegia.  At this point, we removed our aortic cross-clamp.  The heart gradually regained its electromechanical activity.  We placed 2 atrial and 2 ventricular pacing wires.  We removed our aortic vent and oversewed that site with another 4-0 Prolene on an SH needle.  We removed our retrograde cardioplegia catheter.  We oversewed that site with a 5-0 Prolene.  By now, the heart was de-aired and resumed normal electromechanical activity.  We began to wean the patient from cardiopulmonary bypass.  We then removed our venous cannula and suture ligated that site with a #2 silk.  We then gave full-dose protamine.  After knowing that there was no evidence of a protamine reaction, we removed the aortic cannula.  We buttressed that site with a 4-0 Prolene on an SH needle.  We placed a mediastinal chest tube and brought it out through the skin.  We also placed 2 Blake drains, 1 in the left chest and 1 in the right chest, as the patient had some bilateral pleural effusions.  They were brought out through the skin.  The sternum was closed with #7 wires in an interrupted figure-of-eight fashion.  The fascia was closed with #1 Vicryl.  We closed the subcu tissue with 2-0 Vicryl and the skin with 4-0 PDS.","cardiovascular / pulmonary, cardioplegia, toronto stentless porcine valve, tycron sutures, coronary ostia, porcine valve, retrograde cardioplegia, cardiopulmonary bypass, sutures, valve, insertion, toronto, aortic, stentless, chest, coronary, porcine, cardiopulmonary, prolene, atrial, bypass, heart, aorta,"
63,4635," Thrombosed left forearm loop fistula graft, chronic renal failure, and hyperkalemia.  Thrombectomy of the left forearm loop graft.  The venous outflow was good.  There was stenosis in the mid-venous limb of the graft.", Cardiovascular / Pulmonary,3.0, Thrombectomy ,"PREOPERATIVE DIAGNOSES:,1.  Thrombosed left forearm loop fistula graft.,2.  Chronic renal failure.,3.  Hyperkalemia.,POSTOPERATIVE DIAGNOSES:,1.  Thrombosed left forearm loop fistula graft.,2.  Chronic renal failure.,3.  Hyperkalemia.,PROCEDURE PERFORMED: , Thrombectomy of the left forearm loop graft.,ANESTHESIA: , Local with sedation.,ESTIMATED BLOOD LOSS: , Less than 5 cc.,COMPLICATIONS:, None.,OPERATIVE FINDINGS:,  The venous outflow was good.  There was stenosis in the mid-venous limb of the graft.,INDICATIONS: , The patient is an 81-year-old African-American female who presents with an occluded left forearm loop graft.  She was not able to have her dialysis as routine.  Her potassium was dramatically elevated at 7 the initial evening of anticipated surgery.  Both Surgery and Anesthesia thought this would be too risky to do.  Thus, she was given medications to decrease her potassium and a temporary hemodialysis catheter was placed in the femoral vein noted for her to have dialysis that night as well as this morning.  This morning her predialysis potassium was 6, and thus she was scheduled for surgery after her dialysis.,PROCEDURE: , The patient was taken to the operative suite and prepped and draped in the usual sterile fashion.  A transverse incision was made at the region of the venous anastomosis of the graft.  Further dissection was carried down to the catheter.  The vein appeared to be soft and without thrombus.  This outflow did not appear to be significantly impaired.  A transverse incision was made with a #11 blade on the venous limb of the graft near the anastomosis.  Next, a thrombectomy was done using a #4 Fogarty catheter.  Some of the clot and thrombus was removed from the venous limb.  The balloon did hang up in the multiple places along the venous limb signifying some degree of stenosis.  Once removing most of the clots from the venous limb prior to removing the plug, dilators were passed down the venous limb also indicating the area of stenosis.  At this point, we felt the patient would benefit from a curettage of the venous limb of the graft.  This was done and subsequent passes with the dilator and the balloon were then very easy and smooth following the curettage.  The Fogarty balloon was then passed beyond the clot and the plug.  The plug was visualized and inspected.  This also gave a good brisk bleeding from the graft.  The patient was heparinized and hep saline solution was injected into the venous limb and the angle vascular clamp was applied to the venous limb.  Attention was directed up to its anastomosis and the vein.  Fogarty balloon and thrombectomy was also performed well enough into this way.  There was good venous back bleeding following this.  The area was checked for any stenosis with the dilators and none was present.  Next, a #6-0 Prolene suture was used in a running fashion to close the graft.  Just prior to tying the suture, the graft was allowed to flush to move any debris or air.  The suture was also checked at that point for augmentation, which was good.  The suture was tied down and the wound was irrigated with antibiotic solution.  Next, a #3-0 Vicryl was used to approximate the subcutaneous tissues and a #4-0 undyed Vicryl was used in a running subcuticular fashion to approximate the skin edges.  Steri-Strips were applied and the patient was taken to recovery in stable condition.  She tolerated the procedure well.  She will be discharged from recovery when stable.  She is to resume her regular dialysis schedule and present for dialysis tomorrow.","cardiovascular / pulmonary, thrombosed, hyperkalemia, thrombectomy, forearm loop graft, venous outflow, chronic renal failure, venous limb, loop graft, forearm loop, limb, forearm, graft, venous, anastomosis, stenosis,"
64,4636," Thromboendarterectomy of right common, external, and internal carotid artery utilizing internal shunt and Dacron patch angioplasty closure.  Coronary artery bypass grafting x3 utilizing left internal mammary artery to left anterior descending, and reverse autogenous saphenous vein graft to the obtuse marginal, posterior descending branch of the right coronary artery.", Cardiovascular / Pulmonary,3.0, Thromboendarterectomy ,"OPERATIVE PROCEDURE,1.  Thromboendarterectomy of right common, external, and internal carotid artery utilizing internal shunt and Dacron patch angioplasty closure.,2.  Coronary artery bypass grafting x3 utilizing left internal mammary artery to left anterior descending, and reverse autogenous saphenous vein graft to the obtuse marginal, posterior descending branch of the right coronary artery.  Total cardiopulmonary bypass,cold blood potassium cardioplegia, antegrade and retrograde, for myocardial protection, placement of temporary pacing wires.,DESCRIPTION:,  The patient was brought to the operating room, placed in supine position.  Adequate general endotracheal anesthesia was induced.  Appropriate monitoring lines were placed.  The chest, abdomen and legs were prepped and draped in a sterile fashion.  The greater saphenous vein was harvested from the right upper leg through interrupted skin incisions and was prepared by ligating all branches with 4-0 silk and flushing with vein solution.  The leg was closed with running 3-0 Dexon subcu, and running 4-0 Dexon subcuticular on the skin, and later wrapped.  A median sternotomy incision was made and the left internal mammary artery was dissected free from its takeoff at the subclavian to its bifurcation at the diaphragm and surrounded with papaverine-soaked gauze.  The sternum was closed.  A right carotid incision was made along the anterior border of the sternocleidomastoid muscle and carried down to and through the platysma.  The deep fascia was divided.  The facial vein was divided between clamps and tied with 2-0 silk.  The common carotid artery, takeoff of the external and internal carotid arteries were dissected free, with care taken to identify and preserve the hypoglossal and vagus nerves.  The common carotid artery was double-looped with umbilical tape, takeoff of the external was looped with a heavy silk, distal internal was double-looped with a heavy silk.  Shunts were prepared.  A patch was prepared.  Heparin 50 mg was given IV.  Clamp was placed on the beginning of the takeoff of the external and the proximal common carotid artery.  Distal internal was held with a forceps.  Internal carotid artery was opened with 11-blade.  Potts scissors were then used to extend the aortotomy through the lesion into good internal carotid artery beyond.  The shunt was placed and proximal and distal snares were tightened.  Endarterectomy was carried out under direct vision in the common carotid artery and the internal reaching a fine, feathery distal edge using eversion on the external.  All loose debris was removed and Dacron patch was then sutured in place with running 6-0 Prolene suture, removing the shunt just prior to completing the suture line.  Suture line was completed and the neck was packed.,The pericardium was opened.  A pericardial cradle was created.  The patient was heparinized for cardiopulmonary bypass, cannulated with a single aortic and single venous cannula.  A retrograde cardioplegia cannula was placed with a pursestring of 4-0 Prolene into the coronary sinus, and secured to a Rumel tourniquet.  An antegrade cardioplegia needle sump was placed in the ascending aorta and cardiopulmonary bypass was instituted.  The ascending aorta was cross-clamped and cold blood potassium cardioplegia was given antegrade, a total of 5 cc per kg.  This was followed sumping of the ascending aorta and retrograde cardioplegia, a total of 5 cc per kg to the coronary sinus.  The obtuse marginal 1 coronary was identified and opened, and an end-to-side anastomosis was then performed with running 7-0 Prolene suture.  The vein was cut to length.  Antegrade and retrograde cold blood potassium cardioplegia was given.  The obtuse marginal 2 was not felt to be suitable for bypass, therefore, the posterior descending of the right coronary was identified and opened, and an end-to-side anastomosis was then performed with running 7-0 Prolene suture to reverse autogenous saphenous vein.  The vein was cut to length.  The mammary was clipped distally, divided and spatulated for anastomosis.  Antegrade and retrograde cold blood potassium cardioplegia was given.  The anterior descending was identified and opened. the mammary was then sutured to this with running 8-0 Prolene suture.  Warm blood potassium cardioplegia was given, and the cross-clamp was removed.  A partial-occlusion clamp was placed.  Two aortotomies were made.  The veins were cut to fit these and sutured in place with running 5-0 Prolene suture.  The partial- occlusion clamp was removed.  All anastomoses were inspected and noted to be patent and dry.  Atrial and ventricular pacing wires were placed.  Ventilation was commenced.  The patient was fully warmed.  The patient was weaned from cardiopulmonary bypass and de-cannulated in a routine fashion.  Protamine was given.  Good hemostasis was noted.  A single mediastinal chest tube and bilateral pleural Blake drains were placed.  The sternum was closed with figure-of-eight stainless steel wire, the linea alba with figure-of-eight #1 Vicryl, the sternal fascia with running #1 Vicryl, the subcu with running 2-0 Dexon and the skin with a running 4-0 Dexon subcuticular stitch.","cardiovascular / pulmonary, cabg, thromboendarterectomy, carotid artery, coronary artery bypass, mammary, obtuse, papaverine-soaked, running prolene suture, cardiopulmonary bypass, internal carotid, running prolene, prolene suture, carotid, sutured, artery, prolene, coronary, bypass, veinNOTE"
65,4637," Thrombectomy AV shunt, left forearm and patch angioplasty of the venous anastomosis.  Thrombosed arteriovenous shunt, left forearm with venous anastomotic stenosis.", Cardiovascular / Pulmonary,3.0, Thrombectomy AV Shunt ,"PREOPERATIVE DIAGNOSIS: , Thrombosed arteriovenous shunt left forearm.,POSTOPERATIVE DIAGNOSIS:  ,Thrombosed arteriovenous shunt, left forearm with venous anastomotic stenosis.,PROCEDURE:  ,Thrombectomy AV shunt, left forearm and patch angioplasty of the venous anastomosis.,ANESTHESIA: , Local.,SKIN PREP: , Betadine.,DRAINS: , None.,PROCEDURE TECHNIQUE:  ,The left arm was prepped and draped.  Xylocaine 1% was administered and a transverse antecubital incision was made over the venous limb of the graft, which was dissected out and encircled with a vessel loop.  The runoff vein was dissected out and encircled with the vessel loop as well.  A longitudinal incision was made over the venous anastomosis.  There was a narrowing in the area and slightly the incision was extended more proximally.  There was good back bleeding from the vein as well as bleeding from the more distal vein.  These were occluded with noncrushing DeBakey clamps and the patient was given 5000 units of heparin intravenously.  A #4 Fogarty was used to extract thrombus from the graft systematically until the arterial plug was removed and excellent inflow was established.  There was a narrowing in the mid portion of the venous limb of the graft, which was dilated with a #5 coronary dilator.  The Fogarty catheter was then passed up the vein, but no clot was obtained.  A patch PTFE material was fashioned and was sutured over the graftotomy with running 6-0 Gore-Tex suture.  Clamps were removed and flow established.  A thrill was easily palpable.  Hemostasis was achieved and the wound was irrigated and closed with 3-0 Vicryl subcutaneous suture followed by 4-0 nylon on the skin.  A sterile dressing was applied.  The patient was taken to the recovery room in satisfactory condition having tolerated the procedure well.  Sponge, instrument and needle counts were reported as correct.","cardiovascular / pulmonary, angioplasty, venous, anastomosis, patch angioplasty, av shunt, venous anastomosis, av, thrombectomy, thrombosed, arteriovenous, vein, forearm, shunt,"
66,4638, Left muscle sparing mini thoracotomy with left upper lobectomy and mediastinal lymph node dissection.  Intercostal nerve block for postoperative pain relief at five levels., Cardiovascular / Pulmonary,3.0, Thoracotomy & Lobectomy ,"PREOPERATIVE DIAGNOSES:,1.  Non-small-cell carcinoma of the left upper lobe.,2.  History of lymphoma in remission.,POSTOPERATIVE DIAGNOSES:,1.  Non-small-cell carcinoma of the left upper lobe.,2.  History of lymphoma in remission.,PROCEDURE: , Left muscle sparing mini thoracotomy with left upper lobectomy and mediastinal lymph node dissection.  Intercostal nerve block for postoperative pain relief at five levels.,INDICATIONS FOR THE PROCEDURE: , This is an 84-year-old lady who was referred by Dr. A for treatment of her left upper lobe carcinoma.  The patient has a history of lymphoma and is in remission.  An enlarged right axillary lymph node was biopsied recently and was negative for lymphoma.  A mass in the left upper lobe was biopsied with fine-needle aspiration and shown to be a primary non-small-cell carcinoma of the lung.  PET scan was, otherwise, negative for spread and resection was advised.  All the risk and benefits were fully explained to the patient and she elected to proceed as planned.  She was transferred to rehab for couple of weeks to buildup strength before the surgery.,PROCEDURE IN DETAIL:,  In the operating room under anesthesia, she was prepped and draped suitably.  Dr. B was the staff anesthesiologist.  Left muscle sparing mini thoracotomy was made.  The serratus and latissimus muscles were not cut but moved out to the way.  Access to the chest was obtained through the fifth intercostal space.  Two Tuffier retractors of right angles provided adequate exposure.,The inferior pulmonary ligament was not dissected free and lymph nodes from the station 9 were now sent for pathology.  The parietal pleural reflexion around the hilum was now circumcised, and lymph nodes were taken from station 8 and station 5.,The branches of the pulmonary artery to the upper lobe were now individually stapled with a 30/2.5 staple gun or/and the smaller one were ligated with 2-0 silk.  The left superior pulmonary vein was transected using a TA30/2.5 staple gun, and the fissure was completed using firings of an endo-GIA 60/4.8 staple gun.  Finally, the left upper lobe bronchus was transected using a TA30/4.8 staple gun.  Please note, that this patient had been somewhat unusual variant of a small bronchus that was coming out posterior to the main trunk of the pulmonary artery and supplying a small section of the posterior portion of the left upper lobe.,The specimen was delivered and sent to pathology.  The mass was clearly palpable in the upper portion of the lingular portion of this left upper lobe.  Frozen section showed that the margin was negative.,The chest was irrigated with warm sterile water and when the left lower lobe inflated, there was no air leak.  A single 32-French chest tube was inserted, and intercostal block was done with Marcaine infiltrated two spaces above and two spaces below thus achieving a block at five levels 30 mL of Marcaine was used all together.  A #2 Vicryl pericostal sutures were now applied.  The serratus and latissimus muscles retracted back in place.  A #19 French Blake drain placed in the subcutaneous tissues and 2-0 Vicryl used for the fat followed by 4-0 Monocryl for the skin.  The patient was transferred to the ICU in a stable condition.","cardiovascular / pulmonary, upper lobe, intercostal nerve block, non-small-cell carcinoma, axillary lymph node, endo-gia, latissimus, lobectomy, lymph node dissection, lymphoma, pulmonary vein, serratus, thoracotomy, muscle sparing mini thoracotomy, upper lobectomy, staple gun, intercostal,"
